{
  "$schema": "http://json-schema.org/draft-07/schema#",
  "type": "object",
  "properties": {
    "id": { "type": "string" },
    "name": { "type": "string" },
    "country": { "type": "string" },
    "tags": {
      "type": "array",
      "items": { "type": "string" }
    }
  }
}