
            {
                "id": "p059",
                "name": "Midnight Carousel",
                "country": "United Kingdom",
                "tags": [
                    
                        "Trance",
                        "Progressive House"
                ]
            }
        